{
  "case_id": "OGEXP-GT-2026-0051",
  "version": "2.0",
  "created_at": "2026-06-20T22:59:33.746154+00:00",
  "updated_at": "2026-06-20T23:13:46.135336+00:00",
  "status": "draft",
  "source": {
    "business_scenario": "复杂表达式阻止谓词下推",
    "database_version": "openGauss 7.0.0-RC1",
    "database_mode": "centralized",
    "table_size_class": "medium",
    "data_volume_rows": 16049,
    "collection_date": "2026-06-20",
    "collector_id": "ogagila-auto",
    "anonymized": true,
    "redaction_notes": "Synthetic Pagila schema; no real customer data"
  },
  "input": {
    "sql": "SELECT * FROM rental\nWHERE EXTRACT(YEAR FROM rental_date) = 2022\nLIMIT 10",
    "explain_output": "-- @id: Q51\n-- @target: PUSH-001\n-- @severity: warning\n-- @scenario: 复杂表达式阻止谓词下推\nSELECT * FROM rental\nWHERE EXTRACT(YEAR FROM rental_date) = 2022\nLIMIT 10;\n\nLimit  (cost=0.00..48.91 rows=10 width=40) (actual time=0.386..0.391 rows=10 loops=1)\n  ->  Seq Scan on rental  (cost=0.00..401.08 rows=82 width=40) (actual time=0.383..0.387 rows=10 loops=1)\n        Filter: (date_part('year'::text, rental_date) = 2022::double precision)\nTotal runtime: 0.470 ms\n",
    "explain_format": "text",
    "has_analyze": true,
    "plan_actual_runtime_ms": 0,
    "related_tables": [
      "rental"
    ]
  },
  "ground_truth": {
    "is_problematic": true,
    "expected_severity_if_problematic": "warning",
    "root_causes": [
      {
        "cause_id": "RC-1",
        "category": "pushdown_missed",
        "ogexplain_rule_id": "PUSH-001",
        "ogexplain_rule_category": "PUSH-",
        "severity": "warning",
        "description": "复杂表达式阻止谓词下推",
        "evidence": "->  Seq Scan on rental  (cost=0.00..401.08 rows=82 width=40) (actual time=0.383..0.387 rows=10 loops=1)\nFilter: (date_part('year'::text, rental_date) = 2022::double precision)",
        "verification_method": "runtime_trace",
        "verification_detail": "EXPLAIN ANALYZE runtime: 0ms; actually_triggered=False; signal=\"(no signal pattern matched)\"",
        "verified_by": [
          "build_cases.py:auto"
        ]
      }
    ],
    "suggested_fixes": [
      {
        "fix_id": "FIX-1",
        "cause_id": "RC-1",
        "type": "rewrite_sql",
        "description": "Default fix template for PUSH-001",
        "sql_or_action": "去掉列上的函数包装,改写谓词",
        "applied": false,
        "effect_validated": false
      }
    ]
  },
  "annotations": [],
  "validation": {
    "consensus_reached": false,
    "disputed_fields": [],
    "arbiter_id": "pending",
    "final_decision_at": null,
    "arbiter_notes": "Auto-generated from queries.sql + ogagila EXPLAIN ANALYZE; needs DBA review."
  },
  "tags": [
    "PUSH-001",
    "db-version:og7.0",
    "schema:pagila",
    "auto-generated"
  ],
  "_auto_eval": {
    "target_rule_designed": "PUSH-001",
    "actually_triggered": false,
    "trigger_signal": "(no signal pattern matched)",
    "run_warnings": []
  }
}