{
  "case_id": "OGEXP-GT-2026-0057",
  "version": "1.0",
  "created_at": "2026-06-20T22:59:33.755960+00:00",
  "updated_at": "2026-06-20T22:59:33.755984+00:00",
  "status": "draft",
  "source": {
    "business_scenario": "payment_date 用函数包装,无法分区裁剪",
    "database_version": "openGauss 7.0.0-RC1",
    "database_mode": "centralized",
    "table_size_class": "medium",
    "data_volume_rows": 16049,
    "collection_date": "2026-06-20",
    "collector_id": "ogagila-auto",
    "anonymized": true,
    "redaction_notes": "Synthetic Pagila schema; no real customer data"
  },
  "input": {
    "sql": "SELECT COUNT(*) FROM payment WHERE EXTRACT(MONTH FROM payment_date) = 3",
    "explain_output": "-- @id: Q57\n-- @target: PART-001\n-- @severity: warning\n-- @scenario: payment_date 用函数包装,无法分区裁剪\nSELECT COUNT(*) FROM payment WHERE EXTRACT(MONTH FROM payment_date) = 3;\n\nAggregate  (cost=362.94..362.94 rows=1 width=8) (actual time=7.144..7.144 rows=1 loops=1)\n  ->  Partition Iterator  (cost=0.00..362.74 rows=80 width=0) (actual time=1.121..6.698 rows=2713 loops=1)\n        Iterations: 7\n        ->  Partitioned Seq Scan on payment  (cost=0.00..362.74 rows=80 width=0) (actual time=5.036..6.207 rows=2713 loops=7)\n              Filter: (date_part('month'::text, payment_date) = 3::double precision)\n              Rows Removed by Filter: 13336\n              Selected Partitions:  1..7\nTotal runtime: 7.320 ms\n",
    "explain_format": "text",
    "has_analyze": true,
    "plan_actual_runtime_ms": 7,
    "related_tables": [
      "payment"
    ]
  },
  "ground_truth": {
    "is_problematic": true,
    "expected_severity_if_problematic": "warning",
    "root_causes": [
      {
        "cause_id": "RC-1",
        "category": "partition_pruning_failed",
        "ogexplain_rule_id": "PART-001",
        "ogexplain_rule_category": "PART-",
        "severity": "warning",
        "description": "payment_date 用函数包装,无法分区裁剪",
        "evidence": "->  Partitioned Seq Scan on payment  (cost=0.00..362.74 rows=80 width=0) (actual time=5.036..6.207 rows=2713 loops=7)\nFilter: (date_part('month'::text, payment_date) = 3::double precision)\nRows Removed by Filter: 13336",
        "verification_method": "runtime_trace",
        "verification_detail": "EXPLAIN ANALYZE runtime: 7ms; actually_triggered=True; signal=\"Selected Partitions: 1..7\"",
        "verified_by": [
          "build_cases.py:auto"
        ]
      }
    ],
    "suggested_fixes": [
      {
        "fix_id": "FIX-1",
        "cause_id": "RC-1",
        "type": "rewrite_sql",
        "description": "Default fix template for PART-001",
        "sql_or_action": "谓词改用分区键直接比较",
        "applied": false,
        "effect_validated": false
      }
    ]
  },
  "annotations": [],
  "validation": {
    "consensus_reached": false,
    "disputed_fields": [],
    "arbiter_id": "pending",
    "final_decision_at": null,
    "arbiter_notes": "Auto-generated from queries.sql + ogagila EXPLAIN ANALYZE; needs DBA review."
  },
  "tags": [
    "PART-001",
    "db-version:og7.0",
    "schema:pagila",
    "auto-generated"
  ],
  "_auto_eval": {
    "target_rule_designed": "PART-001",
    "actually_triggered": true,
    "trigger_signal": "Selected Partitions: 1..7",
    "run_warnings": []
  }
}