{
  "case_id": "OGEXP-GT-2026-0089",
  "version": "1.0",
  "created_at": "2026-06-20T22:59:33.905859+00:00",
  "updated_at": "2026-06-20T22:59:33.905885+00:00",
  "status": "draft",
  "source": {
    "business_scenario": "actor 主键点查",
    "database_version": "openGauss 7.0.0-RC1",
    "database_mode": "centralized",
    "table_size_class": "medium",
    "data_volume_rows": 16049,
    "collection_date": "2026-06-20",
    "collector_id": "ogagila-auto",
    "anonymized": true,
    "redaction_notes": "Synthetic Pagila schema; no real customer data"
  },
  "input": {
    "sql": "SELECT * FROM actor WHERE actor_id = 25",
    "explain_output": "-- @id: Q89\n-- @target: NONE\n-- @severity: info\n-- @scenario: actor 主键点查\nSELECT * FROM actor WHERE actor_id = 25;\n\nIndex Scan using actor_pkey on actor  (cost=0.00..8.27 rows=1 width=25) (actual time=0.017..0.017 rows=1 loops=1)\n  Index Cond: (actor_id = 25)\nTotal runtime: 0.063 ms\n",
    "explain_format": "text",
    "has_analyze": true,
    "plan_actual_runtime_ms": 0,
    "related_tables": [
      "actor"
    ]
  },
  "ground_truth": {
    "is_problematic": false,
    "expected_severity_if_problematic": null,
    "root_causes": [
      {
        "cause_id": "RC-1",
        "category": "no_real_problem",
        "severity": "info",
        "description": "No real performance problem; query is well-optimized.",
        "evidence": "Index Cond: (actor_id = 25)",
        "verification_method": "runtime_trace",
        "verification_detail": "EXPLAIN ANALYZE runtime: 0ms",
        "verified_by": [
          "build_cases.py:auto"
        ]
      }
    ],
    "suggested_fixes": []
  },
  "annotations": [],
  "validation": {
    "consensus_reached": false,
    "disputed_fields": [],
    "arbiter_id": "pending",
    "final_decision_at": null,
    "arbiter_notes": "Auto-generated from queries.sql + ogagila EXPLAIN ANALYZE; needs DBA review."
  },
  "tags": [
    "NONE",
    "db-version:og7.0",
    "schema:pagila",
    "auto-generated"
  ],
  "_auto_eval": {
    "target_rule_designed": "NONE",
    "actually_triggered": false,
    "trigger_signal": "(no signal pattern matched)",
    "run_warnings": []
  }
}