{
  "case_id": "OGEXP-GT-2026-0074",
  "version": "2.0",
  "created_at": "2026-06-20T22:59:33.780701+00:00",
  "updated_at": "2026-06-20T23:13:46.135336+00:00",
  "status": "draft",
  "source": {
    "business_scenario": "多列 GROUP BY",
    "database_version": "openGauss 7.0.0-RC1",
    "database_mode": "centralized",
    "table_size_class": "medium",
    "data_volume_rows": 16049,
    "collection_date": "2026-06-20",
    "collector_id": "ogagila-auto",
    "anonymized": true,
    "redaction_notes": "Synthetic Pagila schema; no real customer data"
  },
  "input": {
    "sql": "SET work_mem = '64kB';\nSELECT customer_id, staff_id, COUNT(*), SUM(amount)\nFROM payment\nGROUP BY customer_id, staff_id;\nRESET work_mem",
    "explain_output": "-- @id: Q74\n-- @target: AGG-002\n-- @severity: warning\n-- @scenario: 多列 GROUP BY\nSET work_mem = '64kB';\nSELECT customer_id, staff_id, COUNT(*), SUM(amount)\nFROM payment\nGROUP BY customer_id, staff_id;\nRESET work_mem;\n\nHashAggregate  (cost=565.50..665.48 rows=1198 width=54) (actual time=19.472..29.362 rows=1198 loops=1)\n  Group By Key: customer_id, staff_id\nTemp File Num: 48\n  ->  Partition Iterator  (cost=0.00..282.49 rows=16049 width=14) (actual time=0.025..6.723 rows=16049 loops=1)\n        Iterations: 7\n        ->  Partitioned Seq Scan on payment  (cost=0.00..282.49 rows=16049 width=14) (actual time=0.084..3.681 rows=16049 loops=7)\n              Selected Partitions:  1..7\nTotal runtime: 29.791 ms\n",
    "explain_format": "text",
    "has_analyze": true,
    "plan_actual_runtime_ms": 29,
    "related_tables": [
      "payment"
    ]
  },
  "ground_truth": {
    "is_problematic": true,
    "expected_severity_if_problematic": "warning",
    "root_causes": [
      {
        "cause_id": "RC-1",
        "category": "memory_pressure",
        "ogexplain_rule_id": "AGG-002",
        "ogexplain_rule_category": "AGG-",
        "severity": "warning",
        "description": "多列 GROUP BY",
        "evidence": "->  Partitioned Seq Scan on payment  (cost=0.00..282.49 rows=16049 width=14) (actual time=0.084..3.681 rows=16049 loops=7)\nSelected Partitions:  1..7",
        "verification_method": "runtime_trace",
        "verification_detail": "EXPLAIN ANALYZE runtime: 29ms; actually_triggered=True; signal=\"HashAggregate present\"",
        "verified_by": [
          "build_cases.py:auto"
        ]
      }
    ],
    "suggested_fixes": [
      {
        "fix_id": "FIX-1",
        "cause_id": "RC-1",
        "type": "tune_param",
        "description": "Default fix template for AGG-002",
        "sql_or_action": "SET work_mem = '256MB';",
        "applied": false,
        "effect_validated": false
      }
    ]
  },
  "annotations": [],
  "validation": {
    "consensus_reached": false,
    "disputed_fields": [],
    "arbiter_id": "pending",
    "final_decision_at": null,
    "arbiter_notes": "Auto-generated from queries.sql + ogagila EXPLAIN ANALYZE; needs DBA review."
  },
  "tags": [
    "AGG-002",
    "db-version:og7.0",
    "schema:pagila",
    "auto-generated",
    "side-effect",
    "skipped-statements"
  ],
  "_auto_eval": {
    "target_rule_designed": "AGG-002",
    "actually_triggered": true,
    "trigger_signal": "HashAggregate present",
    "run_warnings": []
  }
}