{
  "case_id": "OGEXP-GT-2026-0072",
  "version": "1.0",
  "created_at": "2026-06-20T23:59:19.593844+00:00",
  "updated_at": "2026-06-20T23:59:19.593859+00:00",
  "status": "draft",
  "source": {
    "business_scenario": "payment GROUP BY 排序聚合",
    "database_version": "openGauss 7.0.0-RC1",
    "database_mode": "centralized",
    "table_size_class": "medium",
    "data_volume_rows": 16049,
    "collection_date": "2026-06-20",
    "collector_id": "ogagila-auto",
    "anonymized": true,
    "redaction_notes": "Synthetic Pagila schema; no real customer data"
  },
  "input": {
    "sql": "SET enable_hashagg = off;\nSELECT staff_id, COUNT(*) FROM payment GROUP BY staff_id LIMIT 10;\nRESET enable_hashagg",
    "explain_output": "-- @id: Q72\n-- @target: AGG-001\n-- @severity: warning\n-- @scenario: payment GROUP BY 排序聚合\nSET enable_hashagg = off;\nSELECT staff_id, COUNT(*) FROM payment GROUP BY staff_id LIMIT 10;\nRESET enable_hashagg;\n\nLimit  (cost=0.00..1137.51 rows=2 width=12) (actual time=9.527..17.019 rows=2 loops=1)\n  ->  GroupAggregate  (cost=0.00..1137.51 rows=2 width=12) (actual time=9.525..17.016 rows=2 loops=1)\n        Group By Key: staff_id\n        ->  Index Only Scan using idx_fk_payment_staff_id on payment  (cost=0.00..1057.24 rows=16049 width=4) (actual time=1.364..15.041 rows=16049 loops=1)\n              Heap Fetches: 16049\nTotal runtime: 17.155 ms\n",
    "explain_format": "text",
    "has_analyze": true,
    "plan_actual_runtime_ms": 17,
    "related_tables": [
      "payment"
    ]
  },
  "ground_truth": {
    "is_problematic": true,
    "expected_severity_if_problematic": "warning",
    "root_causes": [
      {
        "cause_id": "RC-1",
        "category": "no_real_problem",
        "ogexplain_rule_id": "AGG-001",
        "ogexplain_rule_category": "AGG-",
        "severity": "warning",
        "description": "payment GROUP BY 排序聚合",
        "evidence": "(no obvious signal)",
        "verification_method": "runtime_trace",
        "verification_detail": "EXPLAIN ANALYZE runtime: 17ms; actually_triggered=True; signal=\"GroupAggregate present\"",
        "verified_by": [
          "build_cases.py:auto"
        ]
      }
    ],
    "suggested_fixes": [
      {
        "fix_id": "FIX-1",
        "cause_id": "RC-1",
        "type": "tune_param",
        "description": "Default fix template for AGG-001",
        "sql_or_action": "enable_hashagg=on / enable_sort=on",
        "applied": false,
        "effect_validated": false
      }
    ]
  },
  "annotations": [],
  "validation": {
    "consensus_reached": false,
    "disputed_fields": [],
    "arbiter_id": "pending",
    "final_decision_at": null,
    "arbiter_notes": "Auto-generated from queries.sql + ogagila EXPLAIN ANALYZE; needs DBA review."
  },
  "tags": [
    "AGG-001",
    "db-version:og7.0",
    "schema:pagila",
    "auto-generated",
    "side-effect",
    "skipped-statements"
  ],
  "_auto_eval": {
    "target_rule_designed": "AGG-001",
    "actually_triggered": true,
    "trigger_signal": "GroupAggregate present",
    "run_warnings": []
  }
}