{
  "case_id": "OGEXP-GT-2026-0061",
  "version": "1.0",
  "created_at": "2026-06-20T23:59:19.573374+00:00",
  "updated_at": "2026-06-20T23:59:19.573386+00:00",
  "status": "draft",
  "source": {
    "business_scenario": "customer 主查询 + 相关 rental 子查询",
    "database_version": "openGauss 7.0.0-RC1",
    "database_mode": "centralized",
    "table_size_class": "medium",
    "data_volume_rows": 16049,
    "collection_date": "2026-06-20",
    "collector_id": "ogagila-auto",
    "anonymized": true,
    "redaction_notes": "Synthetic Pagila schema; no real customer data"
  },
  "input": {
    "sql": "SELECT c.customer_id, c.first_name,\n       (SELECT MAX(rental_date) FROM rental r WHERE r.customer_id = c.customer_id) AS last_rental\nFROM customer c\nWHERE c.active = 1\nLIMIT 20",
    "explain_output": "-- @id: Q61\n-- @target: SUBQ-001\n-- @severity: warning\n-- @scenario: customer 主查询 + 相关 rental 子查询\nSELECT c.customer_id, c.first_name,\n       (SELECT MAX(rental_date) FROM rental r WHERE r.customer_id = c.customer_id) AS last_rental\nFROM customer c\nWHERE c.active = 1\nLIMIT 20;\n\nLimit  (cost=0.00..7200.11 rows=20 width=10) (actual time=2.922..97.898 rows=20 loops=1)\n  ->  Seq Scan on customer c  (cost=0.00..210243.35 rows=584 width=10) (actual time=2.918..97.851 rows=20 loops=1)\n        Filter: (active = 1)\n        Rows Removed by Filter: 1\n        SubPlan 1\n          ->  Aggregate  (cost=359.97..359.98 rows=1 width=16) (actual time=97.359..97.369 rows=20 loops=20)\n                ->  Seq Scan on rental r  (cost=0.00..359.90 rows=27 width=8) (actual time=5.743..89.876 rows=549 loops=20)\n                      Filter: (customer_id = c.customer_id)\n                      Rows Removed by Filter: 320331\nTotal runtime: 98.173 ms\n",
    "explain_format": "text",
    "has_analyze": true,
    "plan_actual_runtime_ms": 98,
    "related_tables": [
      "customer",
      "rental"
    ]
  },
  "ground_truth": {
    "is_problematic": true,
    "expected_severity_if_problematic": "warning",
    "root_causes": [
      {
        "cause_id": "RC-1",
        "category": "subquery_inefficiency",
        "ogexplain_rule_id": "SUBQ-001",
        "ogexplain_rule_category": "SUBQ-",
        "severity": "warning",
        "description": "customer 主查询 + 相关 rental 子查询",
        "evidence": "->  Seq Scan on customer c  (cost=0.00..210243.35 rows=584 width=10) (actual time=2.918..97.851 rows=20 loops=1)\nFilter: (active = 1)\nRows Removed by Filter: 1",
        "verification_method": "runtime_trace",
        "verification_detail": "EXPLAIN ANALYZE runtime: 98ms; actually_triggered=True; signal=\"SubPlan node present (correlated subquery NOT lifted)\"",
        "verified_by": [
          "build_cases.py:auto"
        ]
      }
    ],
    "suggested_fixes": [
      {
        "fix_id": "FIX-1",
        "cause_id": "RC-1",
        "type": "rewrite_sql",
        "description": "Default fix template for SUBQ-001",
        "sql_or_action": "改写为 JOIN",
        "applied": false,
        "effect_validated": false
      }
    ]
  },
  "annotations": [],
  "validation": {
    "consensus_reached": false,
    "disputed_fields": [],
    "arbiter_id": "pending",
    "final_decision_at": null,
    "arbiter_notes": "Auto-generated from queries.sql + ogagila EXPLAIN ANALYZE; needs DBA review."
  },
  "tags": [
    "SUBQ-001",
    "db-version:og7.0",
    "schema:pagila",
    "auto-generated"
  ],
  "_auto_eval": {
    "target_rule_designed": "SUBQ-001",
    "actually_triggered": true,
    "trigger_signal": "SubPlan node present (correlated subquery NOT lifted)",
    "run_warnings": []
  }
}