{
  "case_id": "OGEXP-GT-2026-0052",
  "version": "1.0",
  "created_at": "2026-06-20T23:59:19.559395+00:00",
  "updated_at": "2026-06-20T23:59:19.559400+00:00",
  "status": "draft",
  "source": {
    "business_scenario": "函数包裹索引列,阻止下推",
    "database_version": "openGauss 7.0.0-RC1",
    "database_mode": "centralized",
    "table_size_class": "medium",
    "data_volume_rows": 16049,
    "collection_date": "2026-06-20",
    "collector_id": "ogagila-auto",
    "anonymized": true,
    "redaction_notes": "Synthetic Pagila schema; no real customer data"
  },
  "input": {
    "sql": "SELECT * FROM film WHERE UPPER(title) = 'ACADEMY DINOSAUR'",
    "explain_output": "-- @id: Q52\n-- @target: PUSH-001\n-- @severity: warning\n-- @scenario: 函数包裹索引列,阻止下推\nSELECT * FROM film WHERE UPPER(title) = 'ACADEMY DINOSAUR';\n\nSeq Scan on film  (cost=0.00..70.00 rows=5 width=390) (actual time=1.569..3.114 rows=1 loops=1)\n  Filter: (upper(title) = 'ACADEMY DINOSAUR'::text)\n  Rows Removed by Filter: 999\nTotal runtime: 3.215 ms\n",
    "explain_format": "text",
    "has_analyze": true,
    "plan_actual_runtime_ms": 3,
    "related_tables": [
      "film"
    ]
  },
  "ground_truth": {
    "is_problematic": true,
    "expected_severity_if_problematic": "warning",
    "root_causes": [
      {
        "cause_id": "RC-1",
        "category": "pushdown_missed",
        "ogexplain_rule_id": "PUSH-001",
        "ogexplain_rule_category": "PUSH-",
        "severity": "warning",
        "description": "函数包裹索引列,阻止下推",
        "evidence": "Seq Scan on film  (cost=0.00..70.00 rows=5 width=390) (actual time=1.569..3.114 rows=1 loops=1)\nFilter: (upper(title) = 'ACADEMY DINOSAUR'::text)\nRows Removed by Filter: 999",
        "verification_method": "runtime_trace",
        "verification_detail": "EXPLAIN ANALYZE runtime: 3ms; actually_triggered=False; signal=\"(no signal pattern matched)\"",
        "verified_by": [
          "build_cases.py:auto"
        ]
      }
    ],
    "suggested_fixes": [
      {
        "fix_id": "FIX-1",
        "cause_id": "RC-1",
        "type": "rewrite_sql",
        "description": "Default fix template for PUSH-001",
        "sql_or_action": "去掉列上的函数包装,改写谓词",
        "applied": false,
        "effect_validated": false
      }
    ]
  },
  "annotations": [],
  "validation": {
    "consensus_reached": false,
    "disputed_fields": [],
    "arbiter_id": "pending",
    "final_decision_at": null,
    "arbiter_notes": "Auto-generated from queries.sql + ogagila EXPLAIN ANALYZE; needs DBA review."
  },
  "tags": [
    "PUSH-001",
    "db-version:og7.0",
    "schema:pagila",
    "auto-generated"
  ],
  "_auto_eval": {
    "target_rule_designed": "PUSH-001",
    "actually_triggered": false,
    "trigger_signal": "(no signal pattern matched)",
    "run_warnings": []
  }
}