{
  "case_id": "OGEXP-GT-2026-0069",
  "version": "2.0",
  "created_at": "2026-06-20T22:59:33.770921+00:00",
  "updated_at": "2026-06-20T23:13:46.135336+00:00",
  "status": "draft",
  "source": {
    "business_scenario": "聚合查询触发 Row Adapter",
    "database_version": "openGauss 7.0.0-RC1",
    "database_mode": "centralized",
    "table_size_class": "medium",
    "data_volume_rows": 16049,
    "collection_date": "2026-06-20",
    "collector_id": "ogagila-auto",
    "anonymized": true,
    "redaction_notes": "Synthetic Pagila schema; no real customer data"
  },
  "input": {
    "sql": "SELECT c.customer_id, COUNT(*) AS cnt, SUM(p.amount) AS total\nFROM customer c\nJOIN payment p ON c.customer_id = p.customer_id\nGROUP BY c.customer_id\nLIMIT 20",
    "explain_output": "-- @id: Q69\n-- @target: VEC-001\n-- @severity: info\n-- @scenario: 聚合查询触发 Row Adapter\nSELECT c.customer_id, COUNT(*) AS cnt, SUM(p.amount) AS total\nFROM customer c\nJOIN payment p ON c.customer_id = p.customer_id\nGROUP BY c.customer_id\nLIMIT 20;\n\nLimit  (cost=0.08..28.46 rows=20 width=50) (actual time=0.727..3.939 rows=20 loops=1)\n  ->  GroupAggregate  (cost=0.08..1699.60 rows=1198 width=50) (actual time=0.724..3.919 rows=20 loops=1)\n        Group By Key: c.customer_id\n        ->  Merge Join  (cost=0.08..1567.25 rows=16049 width=10) (actual time=0.392..3.097 rows=544 loops=1)\n              Merge Cond: (c.customer_id = p.customer_id)\n              ->  Index Only Scan using customer_pkey on customer c  (cost=0.00..59.22 rows=1198 width=4) (actual time=0.129..0.375 rows=21 loops=1)\n                    Heap Fetches: 41\n              ->  Index Scan using idx_fk_payment_customer_id on payment p  (cost=0.00..1304.50 rows=16049 width=10) (actual time=0.097..1.946 rows=544 loops=1)\nTotal runtime: 4.701 ms\n",
    "explain_format": "text",
    "has_analyze": true,
    "plan_actual_runtime_ms": 4,
    "related_tables": [
      "customer",
      "payment"
    ]
  },
  "ground_truth": {
    "is_problematic": true,
    "expected_severity_if_problematic": "info",
    "root_causes": [
      {
        "cause_id": "RC-1",
        "category": "vectorization_disabled",
        "ogexplain_rule_id": "VEC-001",
        "ogexplain_rule_category": "VEC-",
        "severity": "info",
        "description": "聚合查询触发 Row Adapter",
        "evidence": "(no obvious signal)",
        "verification_method": "runtime_trace",
        "verification_detail": "EXPLAIN ANALYZE runtime: 4ms; actually_triggered=True; signal=\"Row/Vector Adapter present\"",
        "verified_by": [
          "build_cases.py:auto"
        ]
      }
    ],
    "suggested_fixes": [
      {
        "fix_id": "FIX-1",
        "cause_id": "RC-1",
        "type": "tune_param",
        "description": "Default fix template for VEC-001",
        "sql_or_action": "检查混合存储引擎",
        "applied": false,
        "effect_validated": false
      }
    ]
  },
  "annotations": [],
  "validation": {
    "consensus_reached": false,
    "disputed_fields": [],
    "arbiter_id": "pending",
    "final_decision_at": null,
    "arbiter_notes": "Auto-generated from queries.sql + ogagila EXPLAIN ANALYZE; needs DBA review."
  },
  "tags": [
    "VEC-001",
    "db-version:og7.0",
    "schema:pagila",
    "auto-generated"
  ],
  "_auto_eval": {
    "target_rule_designed": "VEC-001",
    "actually_triggered": true,
    "trigger_signal": "Row/Vector Adapter present",
    "run_warnings": []
  }
}