{
  "case_id": "OGEXP-GT-2026-0075",
  "version": "2.0",
  "created_at": "2026-06-20T22:59:33.784509+00:00",
  "updated_at": "2026-06-20T23:13:46.135336+00:00",
  "status": "draft",
  "source": {
    "business_scenario": "payment 无分布键提示,触发重分布",
    "database_version": "openGauss 7.0.0-RC1",
    "database_mode": "centralized",
    "table_size_class": "medium",
    "data_volume_rows": 16049,
    "collection_date": "2026-06-20",
    "collector_id": "ogagila-auto",
    "anonymized": true,
    "redaction_notes": "Synthetic Pagila schema; no real customer data"
  },
  "input": {
    "sql": "SELECT p.payment_id, c.first_name\nFROM payment p\nJOIN customer c ON p.customer_id = c.customer_id\nLIMIT 20",
    "explain_output": "-- @id: Q75\n-- @target: DIST-001\n-- @severity: info\n-- @scenario: payment 无分布键提示,触发重分布\nSELECT p.payment_id, c.first_name\nFROM payment p\nJOIN customer c ON p.customer_id = c.customer_id\nLIMIT 20;\n\nLimit  (cost=0.08..2.05 rows=20 width=10) (actual time=0.106..0.241 rows=20 loops=1)\n  ->  Merge Join  (cost=0.08..1575.25 rows=16049 width=10) (actual time=0.104..0.237 rows=20 loops=1)\n        Merge Cond: (c.customer_id = p.customer_id)\n        ->  Index Scan using customer_pkey on customer c  (cost=0.00..67.22 rows=1198 width=10) (actual time=0.014..0.014 rows=1 loops=1)\n        ->  Index Scan using idx_fk_payment_customer_id on payment p  (cost=0.00..1304.50 rows=16049 width=8) (actual time=0.082..0.207 rows=20 loops=1)\nTotal runtime: 0.389 ms\n",
    "explain_format": "text",
    "has_analyze": true,
    "plan_actual_runtime_ms": 0,
    "related_tables": [
      "customer",
      "payment"
    ]
  },
  "ground_truth": {
    "is_problematic": true,
    "expected_severity_if_problematic": "info",
    "root_causes": [
      {
        "cause_id": "RC-1",
        "category": "no_real_problem",
        "ogexplain_rule_id": "DIST-001",
        "ogexplain_rule_category": "DIST-",
        "severity": "info",
        "description": "payment 无分布键提示,触发重分布",
        "evidence": "(no obvious signal)",
        "verification_method": "runtime_trace",
        "verification_detail": "EXPLAIN ANALYZE runtime: 0ms; actually_triggered=False; signal=\"(no signal pattern matched)\"",
        "verified_by": [
          "build_cases.py:auto"
        ]
      }
    ],
    "suggested_fixes": [
      {
        "fix_id": "FIX-1",
        "cause_id": "RC-1",
        "type": "tune_param",
        "description": "Default fix template for DIST-001",
        "sql_or_action": "调整分布列",
        "applied": false,
        "effect_validated": false
      }
    ]
  },
  "annotations": [],
  "validation": {
    "consensus_reached": false,
    "disputed_fields": [],
    "arbiter_id": "pending",
    "final_decision_at": null,
    "arbiter_notes": "Auto-generated from queries.sql + ogagila EXPLAIN ANALYZE; needs DBA review."
  },
  "tags": [
    "DIST-001",
    "db-version:og7.0",
    "schema:pagila",
    "auto-generated"
  ],
  "_auto_eval": {
    "target_rule_designed": "DIST-001",
    "actually_triggered": false,
    "trigger_signal": "(no signal pattern matched)",
    "run_warnings": []
  }
}