{
  "case_id": "OGEXP-GT-2026-0062",
  "version": "1.0",
  "created_at": "2026-06-20T23:59:19.574343+00:00",
  "updated_at": "2026-06-20T23:59:19.574353+00:00",
  "status": "draft",
  "source": {
    "business_scenario": "film 主查询 + 相关 film_actor 子查询",
    "database_version": "openGauss 7.0.0-RC1",
    "database_mode": "centralized",
    "table_size_class": "medium",
    "data_volume_rows": 16049,
    "collection_date": "2026-06-20",
    "collector_id": "ogagila-auto",
    "anonymized": true,
    "redaction_notes": "Synthetic Pagila schema; no real customer data"
  },
  "input": {
    "sql": "SELECT f.film_id, f.title,\n       (SELECT COUNT(*) FROM film_actor fa WHERE fa.film_id = f.film_id) AS actor_cnt\nFROM film f\nWHERE f.rating = 'PG'\nLIMIT 20",
    "explain_output": "-- @id: Q62\n-- @target: SUBQ-001\n-- @severity: warning\n-- @scenario: film 主查询 + 相关 film_actor 子查询\nSELECT f.film_id, f.title,\n       (SELECT COUNT(*) FROM film_actor fa WHERE fa.film_id = f.film_id) AS actor_cnt\nFROM film f\nWHERE f.rating = 'PG'\nLIMIT 20;\n\nLimit  (cost=0.00..371.96 rows=20 width=19) (actual time=1.806..4.442 rows=20 loops=1)\n  ->  Seq Scan on film f  (cost=0.00..3608.00 rows=194 width=19) (actual time=1.802..4.431 rows=20 loops=1)\n        Filter: (rating = 'PG'::mpaa_rating)\n        Rows Removed by Filter: 103\n        SubPlan 1\n          ->  Aggregate  (cost=18.24..18.25 rows=1 width=8) (actual time=4.231..4.232 rows=20 loops=20)\n                ->  Bitmap Heap Scan on film_actor fa  (cost=4.29..18.23 rows=5 width=0) (actual time=0.300..4.100 rows=114 loops=20)\n                      Recheck Cond: (film_id = f.film_id)\n                      Heap Blocks: exact=106\n                      ->  Bitmap Index Scan on idx_fk_film_id  (cost=0.00..4.29 rows=5 width=0) (actual time=0.195..0.195 rows=114 loops=20)\n                            Index Cond: (film_id = f.film_id)\nTotal runtime: 4.571 ms\n",
    "explain_format": "text",
    "has_analyze": true,
    "plan_actual_runtime_ms": 4,
    "related_tables": [
      "film",
      "film_actor",
      "idx_fk_film_id"
    ]
  },
  "ground_truth": {
    "is_problematic": true,
    "expected_severity_if_problematic": "warning",
    "root_causes": [
      {
        "cause_id": "RC-1",
        "category": "subquery_inefficiency",
        "ogexplain_rule_id": "SUBQ-001",
        "ogexplain_rule_category": "SUBQ-",
        "severity": "warning",
        "description": "film 主查询 + 相关 film_actor 子查询",
        "evidence": "->  Seq Scan on film f  (cost=0.00..3608.00 rows=194 width=19) (actual time=1.802..4.431 rows=20 loops=1)\nIndex Cond: (film_id = f.film_id)\nFilter: (rating = 'PG'::mpaa_rating)",
        "verification_method": "runtime_trace",
        "verification_detail": "EXPLAIN ANALYZE runtime: 4ms; actually_triggered=True; signal=\"SubPlan node present (correlated subquery NOT lifted)\"",
        "verified_by": [
          "build_cases.py:auto"
        ]
      }
    ],
    "suggested_fixes": [
      {
        "fix_id": "FIX-1",
        "cause_id": "RC-1",
        "type": "rewrite_sql",
        "description": "Default fix template for SUBQ-001",
        "sql_or_action": "改写为 JOIN",
        "applied": false,
        "effect_validated": false
      }
    ]
  },
  "annotations": [],
  "validation": {
    "consensus_reached": false,
    "disputed_fields": [],
    "arbiter_id": "pending",
    "final_decision_at": null,
    "arbiter_notes": "Auto-generated from queries.sql + ogagila EXPLAIN ANALYZE; needs DBA review."
  },
  "tags": [
    "SUBQ-001",
    "db-version:og7.0",
    "schema:pagila",
    "auto-generated"
  ],
  "_auto_eval": {
    "target_rule_designed": "SUBQ-001",
    "actually_triggered": true,
    "trigger_signal": "SubPlan node present (correlated subquery NOT lifted)",
    "run_warnings": []
  }
}