{
  "case_id": "OGEXP-GT-2026-0053",
  "version": "1.0",
  "created_at": "2026-06-20T23:59:19.560436+00:00",
  "updated_at": "2026-06-20T23:59:19.560444+00:00",
  "status": "draft",
  "source": {
    "business_scenario": "算术运算阻止下推",
    "database_version": "openGauss 7.0.0-RC1",
    "database_mode": "centralized",
    "table_size_class": "medium",
    "data_volume_rows": 16049,
    "collection_date": "2026-06-20",
    "collector_id": "ogagila-auto",
    "anonymized": true,
    "redaction_notes": "Synthetic Pagila schema; no real customer data"
  },
  "input": {
    "sql": "SELECT * FROM payment WHERE amount * 2 > 10.00 LIMIT 10",
    "explain_output": "-- @id: Q53\n-- @target: PUSH-001\n-- @severity: warning\n-- @scenario: 算术运算阻止下推\nSELECT * FROM payment WHERE amount * 2 > 10.00 LIMIT 10;\n\nLimit  (cost=0.00..0.68 rows=10 width=30) (actual time=0.043..0.050 rows=10 loops=1)\n  ->  Partition Iterator  (cost=0.00..362.74 rows=5350 width=30) (actual time=0.041..0.048 rows=10 loops=1)\n        Iterations: 7\n        ->  Partitioned Seq Scan on payment  (cost=0.00..362.74 rows=5350 width=30) (actual time=0.023..0.028 rows=10 loops=1)\n              Filter: ((amount * 2::numeric) > 10.00)\n              Rows Removed by Filter: 35\n              Selected Partitions:  1..7\nTotal runtime: 0.167 ms\n",
    "explain_format": "text",
    "has_analyze": true,
    "plan_actual_runtime_ms": 0,
    "related_tables": [
      "payment"
    ]
  },
  "ground_truth": {
    "is_problematic": true,
    "expected_severity_if_problematic": "warning",
    "root_causes": [
      {
        "cause_id": "RC-1",
        "category": "pushdown_missed",
        "ogexplain_rule_id": "PUSH-001",
        "ogexplain_rule_category": "PUSH-",
        "severity": "warning",
        "description": "算术运算阻止下推",
        "evidence": "->  Partitioned Seq Scan on payment  (cost=0.00..362.74 rows=5350 width=30) (actual time=0.023..0.028 rows=10 loops=1)\nFilter: ((amount * 2::numeric) > 10.00)\nRows Removed by Filter: 35",
        "verification_method": "runtime_trace",
        "verification_detail": "EXPLAIN ANALYZE runtime: 0ms; actually_triggered=False; signal=\"(no signal pattern matched)\"",
        "verified_by": [
          "build_cases.py:auto"
        ]
      }
    ],
    "suggested_fixes": [
      {
        "fix_id": "FIX-1",
        "cause_id": "RC-1",
        "type": "rewrite_sql",
        "description": "Default fix template for PUSH-001",
        "sql_or_action": "去掉列上的函数包装,改写谓词",
        "applied": false,
        "effect_validated": false
      }
    ]
  },
  "annotations": [],
  "validation": {
    "consensus_reached": false,
    "disputed_fields": [],
    "arbiter_id": "pending",
    "final_decision_at": null,
    "arbiter_notes": "Auto-generated from queries.sql + ogagila EXPLAIN ANALYZE; needs DBA review."
  },
  "tags": [
    "PUSH-001",
    "db-version:og7.0",
    "schema:pagila",
    "auto-generated"
  ],
  "_auto_eval": {
    "target_rule_designed": "PUSH-001",
    "actually_triggered": false,
    "trigger_signal": "(no signal pattern matched)",
    "run_warnings": []
  }
}