{
  "case_id": "OGEXP-GT-2026-0083",
  "version": "2.0",
  "created_at": "2026-06-20T22:59:33.821681+00:00",
  "updated_at": "2026-06-20T23:13:46.135336+00:00",
  "status": "draft",
  "source": {
    "business_scenario": "小表 Seq Scan 是合理的(actor 200 行)",
    "database_version": "openGauss 7.0.0-RC1",
    "database_mode": "centralized",
    "table_size_class": "medium",
    "data_volume_rows": 16049,
    "collection_date": "2026-06-20",
    "collector_id": "ogagila-auto",
    "anonymized": true,
    "redaction_notes": "Synthetic Pagila schema; no real customer data"
  },
  "input": {
    "sql": "SELECT * FROM actor WHERE last_name = 'GUINESS'",
    "explain_output": "-- @id: Q83\n-- @target: NONE\n-- @severity: info\n-- @scenario: 小表 Seq Scan 是合理的(actor 200 行)\nSELECT * FROM actor WHERE last_name = 'GUINESS';\n\nSeq Scan on actor  (cost=0.00..4.50 rows=3 width=25) (actual time=0.033..0.099 rows=3 loops=1)\n  Filter: (last_name = 'GUINESS'::text)\n  Rows Removed by Filter: 197\nTotal runtime: 0.343 ms\n",
    "explain_format": "text",
    "has_analyze": true,
    "plan_actual_runtime_ms": 0,
    "related_tables": [
      "actor"
    ]
  },
  "ground_truth": {
    "is_problematic": false,
    "expected_severity_if_problematic": null,
    "root_causes": [
      {
        "cause_id": "RC-1",
        "category": "no_real_problem",
        "severity": "info",
        "description": "No real performance problem; query is well-optimized.",
        "evidence": "-- @scenario: 小表 Seq Scan 是合理的(actor 200 行)\nFilter: (last_name = 'GUINESS'::text)\nRows Removed by Filter: 197",
        "verification_method": "runtime_trace",
        "verification_detail": "EXPLAIN ANALYZE runtime: 0ms",
        "verified_by": [
          "build_cases.py:auto"
        ]
      }
    ],
    "suggested_fixes": []
  },
  "annotations": [],
  "validation": {
    "consensus_reached": false,
    "disputed_fields": [],
    "arbiter_id": "pending",
    "final_decision_at": null,
    "arbiter_notes": "Auto-generated from queries.sql + ogagila EXPLAIN ANALYZE; needs DBA review."
  },
  "tags": [
    "NONE",
    "db-version:og7.0",
    "schema:pagila",
    "auto-generated"
  ],
  "_auto_eval": {
    "target_rule_designed": "NONE",
    "actually_triggered": false,
    "trigger_signal": "(no signal pattern matched)",
    "run_warnings": []
  }
}